{
  "$schema": "../../../schemas/v1/release-membership.schema.json",
  "schema_version": 1,
  "membership_id": "v0.2-wave2-initial",
  "release_line": "v0.2",
  "delivery_wave": "wave_2",
  "catalog_id": "briosa.sa.2026.1.0529.7",
  "spatial_analyzer_target": "2026.1.0529.7",
  "catalog_revision": "9",
  "operation_ids": [
    "collection_operations.construct_point_at_circle_center",
    "collection_operations.construct_point_at_line_midpoint",
    "collection_operations.construct_point_fit_to_points",
    "collection_operations.construct_point_group_from_point_name_list",
    "collection_operations.construct_point_in_working_coordinates",
    "collection_operations.delete_points",
    "collection_operations.rename_point"
  ]
}
